{
  "apiVersion": "preview.mini-book-hub.io/v1",
  "kind": "PreviewMetadata",
  "pr": 125,
  "status": "preview-ready",
  "baseMainSha": "abc-main-sha",
  "mergeResultSha": "reader-merge-sha",
  "affectedComponents": ["reader-service"],
  "candidateImages": {
    "reader-service": "ghcr.io/nguyenthanhdat2707/mini-book-hub-reader-service@sha256:candidatereaderservice"
  },
  "stableImageLock": "image-locks/main.json",
  "smokeProfile": "reader-service",
  "createdBy": {
    "ciRunId": "123456791",
    "workflow": "pr-impact-gate"
  }
}
